 {
    "id": "ID 1",
    "status": "Status 1",
    "name": "This is a name",
    "orders": [{
          "readyForDelivery": true,
          "finalDocument": true,
          "receiverStreet": "string",
          "receiverLocation": "string",
          "receiverHouse": "string",
          "receiverBuilding": "string",
          "receiverCorpus": "string",
          "receiverFlat": "string",
          "fragile": true,
          "mailСategory": true,
          "clientName": "string",
          "orderId": "string",
          "receiverCityName": "string",
          "region": "string",
          "index": "string",
          "status": "string",
          "phone": "string",
          "deliveryId": 5,
          "barcode": "string",
          "weight": 5,
          "products": 
            [ {
                "readyForDelivery": true,
                "finalDocument": true,
                "receiverStreet": "string",
                "receiverLocation": "string",
                "receiverHouse": "string",
                "receiverBuilding": "string",
                "receiverCorpus": "string",
                "receiverFlat": "string",
                "fragile": "string",
                "mailСategory": "string",
                "clientName": "string",
                "orderId": "string",
                "receiverCityName": "string",
                "region": "string",
                "index": "string",
                "status": "string",
                "phone": "string",
                "deliveryId": 5,
                "barcode": "string",
                "weight": 8,
                "products":  [ {
                      "productArt": "string",
                      "productName": "string",
                      "productUuid": "string",
                      "quantity": 7,
                      "sku": "string",
                      "status": "string",
                      "weight": 9,
                      "gtin": "string",
                      "serialNumberMark": "string"
                    }],
                "transportPallet": "string",
                "postOffice": "string",
                "orderCreatedAt": "2018-11-13T20:20:39+00:00",
                "mailType": "string",
                "deliveryStatus": [ {
                      "deliveryStatusDate": "2018-11-13T20:20:39+00:00",
                      "deliveryCode": 8,
                      "deliveryAttr": 8,
                      "deliveryStatus": "string",
                      "_id": "string"
                    }]
                
              }]          
        }],
    "storeId": "string",
    "postOffice": "string",
    "createdAt": "2018-11-13T20:20:39+00:00",
    "updatedAt": "2018-11-13T20:20:39+00:00"
  }
